Attribute,Description,Required,Conditional If,Data Type,Valid Values
HTAN Participant ID (PRIMARY KEY),HTAN ID associated with a patient based on HTAN ID SOP (eg HTANx_yyy ),True,,String,
Age at Diagnosis,Age at the time of diagnosis expressed in number of days since birth.,True,,String,
Year of Diagnosis,Numeric value to represent the year of an individual's initial pathologic diagnosis of cancer.,False,,String,
Primary Diagnosis,"Text term used to describe the patient's histologic diagnosis, as described by the World Health Organization's (WHO) International Classification of Diseases for Oncology (ICD-O).",True,,String,Acinar cell carcinoma Acute basophilic leukaemia Acute leukemia Burkitt type Acute leukemia NOS Acute lymphatic leukemia Acute lymphoblastic leukemia-lymphoma NOS Acute lymphoblastic leukemia mature B-cell type Acute lymphoblastic leukemia NOS Acute lymphoblastic leukemia precursor cell type Acute lymphocytic leukemia Acute lymphoid leukemia Acute myeloid leukemia minimal differentiation Acute myeloid leukemia MLL Acute myeloid leukemia NOS Acute myelomonocytic leukemia Acute promyelocytic leukemia NOS Adenocarcinoid tumor Adenocarcinoma combined with other types of carcinoma Adenocarcinoma in a polyp NOS Adenocarcinoma in adenomatous polyp Adenocarcinoma in polypoid adenoma Adenocarcinoma in situ in a polyp NOS Adenocarcinoma in situ in adenomatous polyp Adenocarcinoma in situ in tubular adenoma Adenocarcinoma in situ mucinous Adenocarcinoma in situ non-mucinous Adenocarcinoma in situ NOS Adenocarcinoma in tubular adenoma Adenocarcinoma in villous adenoma Adenocarcinoma of anal ducts Adenocarcinoma of anal glands Adenocarcinoma diffuse type Adenocarcinoma endocervical type Adenocarcinoma intestinal type Adenocarcinoma metastatic NOS Adenocarcinoma NOS Adenocarcinoma pancreatobiliary type Adult rhabdomyoma Adult T-cell lymphoma Adult T-cell lymphoma/leukemia Astrocytoma anaplastic Astrocytoma low grade Astrocytoma NOS B cell lymphoma NOS B lymphoblastic leukemia/lymphoma with hyperdiploidy B lymphoblastic leukemia/lymphoma with hypodiploidy (Hypodiploid ALL) B lymphoblastic leukemia/lymphoma NOS B-ALL B-cell lymphocytic leukemia/small lymphocytic lymphoma Basal cell adenocarcinoma Basal cell adenoma Basal cell carcinoma NOS Basal cell epithelioma Basal cell tumor Basophil adenocarcinoma Basophil adenoma Basophil carcinoma Bile duct adenocarcinoma Bile duct adenoma Bile duct carcinoma Bile duct cystadenocarcinoma Bile duct cystadenoma Bronchial adenoma carcinoid Bronchial adenoma cylindroid Bronchial adenoma NOS Bronchial-associated lymphoid tissue lymphoma Bronchio-alveolar carcinoma mixed mucinous and non-mucinous Bronchio-alveolar carcinoma mucinous Bronchiolar adenocarcinoma Bronchiolar carcinoma Bronchiolo-alveolar adenocarcinoma NOS Bronchiolo-alveolar carcinoma Clara cell Bronchiolo-alveolar carcinoma Clara cell and goblet cell type Bronchiolo-alveolar carcinoma goblet cell type Bronchiolo-alveolar carcinoma indeterminate type Bronchiolo-alveolar carcinoma non-mucinous Bronchiolo-alveolar carcinoma NOS Burkitt cell leukemia Burkitt lymphoma NOS (Includes all variants) Burkitt tumor Burkitt-like lymphoma c-ALL Cancer Capillary hemangioma Capillary lymphangioma Carcinoma in a polyp NOS Carcinoma in adenomatous polyp Carcinoma in pleomorphic adenoma Carcinoma in situ in a polyp NOS Carcinoma in situ in adenomatous polyp Carcinoma in situ NOS Carcinoma anaplastic NOS Carcinoma diffuse type Carcinoma intestinal type Carcinoma metastatic NOS Carcinoma NOS Carcinosarcoma NOS Carcinoma undifferentiated NOS Cementoma NOS Central neuroblastoma Central neurocytoma Cerebellar liponeurocytoma Cerebellar sarcoma NOS Cervical intraepithelial neoplasia grade III Cervical intraepithelial neoplasia low grade Chondroma NOS Chondrosarcoma grade 2/3 Chronic granulocytic leukemia BCR/ABL Chronic granulocytic leukemia NOS Chronic granulocytic leukemia Philadelphia chromosome (Ph1) positive Chronic leukemia NOS Chronic lymphatic leukemia Chronic lymphocytic leukemia Chronic lymphocytic leukemia B-cell type (includes all variants of BCLL) Chronic lymphoid leukemia Chronic monocytic leukemia Chronic myelocytic leukemia NOS Chronic myelogenous leukemia BCR-ABL positive Chronic myelogenous leukemia Philadelphia chromosome (Ph 1) positive Chronic myeloid leukemia NOS Chronic myelomonocytic leukemia in transformation Chronic myelomonocytic leukemia NOS Chronic myelomonocytic leukemia Type 1 Chronic myelomonocytic leukemia Type II Chronic myeloproliferative disease NOS Chronic myeloproliferative disorder Chronic neutrophilic leukemia Classical Hodgkin lymphoma lymphocyte depletion diffuse fibrosis Classical Hodgkin lymphoma lymphocyte depletion NOS Classical Hodgkin lymphoma lymphocyte depletion reticular Classical Hodgkin lymphoma lymphocyte-rich Classical Hodgkin lymphoma mixed cellularity NOS Classical Hodgkin lymphoma nodular sclerosis cellular phase Classical Hodgkin lymphoma nodular sclerosis grade 1 Classical Hodgkin lymphoma nodular sclerosis grade 2 Classical Hodgkin lymphoma nodular sclerosis NOS Combined hepatocellular carcinoma and cholangiocarcinoma Combined large cell neuroendocrine carcinoma Combined small cell carcinoma Combined small cell-adenocarcinoma Combined small cell-large carcinoma Combined small cell-squamous cell carcinoma Combined/mixed carcinoid and adenocarcinoma Composite Hodgkin and non-Hodgkin lymphoma Dermal nevus Dermatofibroma NOS Diffuse astrocytoma IDH-mutant Diffuse astrocytoma IDH-wildtype Diffuse astrocytoma low grade Diffuse large B-cell lymphoma NOS Diffuse melanocytosis Duct adenocarcinoma NOS Duct adenoma NOS Duct carcinoma desmoplastic type Duct carcinoma NOS Duct cell carcinoma Ductal carcinoma in situ NOS Ductal carcinoma NOS Dysplastic nevus Endometrial sarcoma NOS Endometrioid adenocarcinoma NOS Endometrioid adenofibroma NOS Endometrioid adenoma NOS Endometrioid carcinoma NOS Eosinophil adenocarcinoma Eosinophil adenoma Eosinophil carcinoma Eosinophilic granuloma Eosinophilic leukemia Ependymoma NOS Epidermoid carcinoma in situ NOS Epidermoid carcinoma NOS Epithelial tumor benign Epithelial tumor malignant Esophageal glandular dysplasia (intraepithelial neoplasia) high grade Esophageal glandular dysplasia (intraepithelial neoplasia) low grade Esophageal intraepithelial neoplasia high grade Esophageal squamous intraepithelial neoplasia (dysplasia) high grade Esophageal squamous intraepithelial neoplasia (dysplasia) low grade Ewing sarcoma Ganglioglioma NOS Familial adenomatous polyposis Gastrin cell tumor Gastrin cell tumor malignant Gastrinoma malignant Gastrinoma NOS Gastrointestinal stromal tumor malignant Glioblastoma Glioma malignant Glioma NOS Haemangioblastoma Haemangiosarcoma Hepatocarcinoma Hepatocellular adenoma Hepatocellular carcinoma NOS Hepatocholangiocarcinoma Hepatoid adenocarcinoma Hepatoid carcinoma Hodgkin disease NOS Hodgkin granuloma Hodgkin lymphoma mixed cellularity NOS Hodgkin lymphoma nodular sclerosis NOS Hodgkin lymphoma NOS Hodgkin paragranuloma NOS Hodgkin sarcoma Infiltrating basal cell carcinoma NOS Infiltrating duct carcinoma NOS Infiltrating duct and colloid carcinoma Infiltrating duct and cribriform carcinoma Inflammatory adenocarcinoma Inflammatory carcinoma Interstitial cell tumor benign Interstitial cell tumor malignant Interstitial cell tumor NOS Intracystic papilloma Intradermal nevus Intraductal adenocarcinoma noninfiltrating NOS Intraductal and lobular carcinoma Intraductal carcinoma and lobular carcinoma in situ Intraductal carcinoma clinging Intraductal carcinoma noninfiltrating NOS Intraductal carcinoma NOS Intraductal carcinoma solid type Intraductal micropapillary carcinoma Intraductal papillary adenocarcinoma with invasion Intraductal papillary adenocarcinoma NOS Intraductal papillary carcinoma Intraductal tubular-papillary neoplasm high grade Intraductal tubular-papillary neoplasm low grade Intraductal tubulopapillary neoplasm Intraepidermal carcinoma NOS Intraepidermal squamous cell carcinoma Bowen type Intravascular B-cell lymphoma Juvenile myelomonocytic leukemia Kaposi sarcoma Large cell carcinoma NOS Liposarcoma differentiated Liposarcoma NOS Liposarcoma well differentiated Liver cell adenoma Liver cell carcinoma Lobular adenocarcinoma Lobular and ductal carcinoma Lobular carcinoma in situ NOS Lobular carcinoma noninfiltrating Lobular carcinoma NOS Lymphatic leukemic NOS Lymphoblastic leukemia NOS Lymphoblastoma Lymphocytic leukemia NOS Lymphoma NOS Malignancy Malignant lymphoma diffuse NOS Malignant lymphoma Hodgkin Malignant lymphoma immunoblastic NOS Malignant lymphoma large B-cell diffuse NOS Malignant lymphoma large B-cell NOS Malignant lymphoma large cell NOS Malignant lymphoma lymphoblastic NOS Malignant lymphoma lymphocytic diffuse NOS Malignant lymphoma lymphocytic nodular NOS Malignant lymphoma lymphocytic NOS Malignant lymphoma mixed cell type diffuse Malignant lymphoma mixed cell type follicular Malignant lymphoma mixed cell type nodular Malignant lymphoma nodular NOS Malignant lymphoma non-Hodgkin NOS Malignant lymphoma NOS Malignant lymphoma small B lymphocytic NOS Malignant melanoma in congenital melanocytic nevus Malignant melanoma in giant pigmented nevus Malignant melanoma in Hutchinson melanotic freckle Malignant melanoma in junctional nevus Malignant melanoma in precancerous melanosis Malignant melanoma NOS Malignant melanoma regressing Mammary carcinoma in situ Medullary adenocarcinoma Medullary carcinoma NOS Medullary osteosarcoma Medulloblastoma NOS Melanoameloblastoma Melanocytic nevus Melanocytoma eyeball Melanocytoma NOS Melanoma in situ Melanoma malignant of soft parts Melanoma NOS Melanotic medulloblastoma Melanotic MPNST Melanotic neuroectodermal tumor Melanotic neurofibroma Melanotic progonoma Melanotic psammomatous MPNST Melanotic schwannoma Meningeal melanocytoma Meningeal melanoma Meningioma anaplastic Meningioma malignant Meningioma NOS Micropapillary carcinoma NOS Mixed adenocarcinoma and epidermoid carcinoma Mixed adenocarcinoma and squamous cell carcinoma Mixed medullary-follicular carcinoma Mixed medullary-papillary carcinoma Mixed pancreatic endocrine and exocrine tumor malignant Mixed pineal tumor Mixed small cell carcinoma Mixed squamous cell and glandular papilloma Mixed tumor malignant NOS Mixed tumor NOS Monocytic leukemia NOS Mucosal-associated lymphoid tissue lymphoma Mucous adenocarcinoma Multiple myeloma Myelocytic leukemia NOS Myeloid leukemia NOS Myeloma NOS Myoepithelioma Neoplasm benign Neoplasm malignant Neoplasm malignant uncertain whether primary or metastatic Neoplasm metastatic Neoplasm NOS Neoplasm secondary Neoplasm uncertain whether benign or malignant Nephroblastoma NOS Neuroblastoma NOS Neuroendocrine carcinoma NOS Neuroepithelioma NOS Neurofibroma NOS Neurofibromatosis NOS Neurofibrosarcoma Neurosarcoma Nevus NOS Non-Hodgkin lymphoma NOS Non-invasive low grade serous carcinoma Non-lymphocytic leukemia NOS Non-small cell carcinoma Nonpigmented nevus Not Reported Oat cell carcinoma Osteoblastoma malignant Osteoblastoma NOS Osteosarcoma NOS Paget disease and infiltrating duct carcinoma of breast Paget disease and intraductal carcinoma of breast Paget disease of breast Paget disease extramammary Paget disease mammary Pagetoid reticulosis Pancreatic endocrine tumor benign Pancreatic endocrine tumor malignant Pancreatic endocrine tumor nonfunctioning Pancreatic endocrine tumor NOS Pancreatic microadenoma Pancreatobiliary neoplasm non-invasive Pancreatobiliary-type carcinoma Pancreatoblastoma Papillary adenocarcinoma follicular variant Papillary adenocarcinoma NOS Papillary adenofibroma Papillary adenoma NOS Papillary and follicular carcinoma Papillary carcinoma in situ Papillary carcinoma NOS Papillary cystadenoma NOS Papillary epidermoid carcinoma Papillary glioneuronal tumor Papillary meningioma Papillary microcarcinoma Papillary renal cell carcinoma Papillary serous adenocarcinoma Papillary serous cystadenocarcinoma Papillary serous cystadenoma NOS Papillary squamous cell carcinoma Papillary squamous cell carcinoma in situ Papillary transitional cell carcinoma Papillary tumor of the pineal region Papillary urothelial carcinoma Papilloma of bladder Papilloma NOS Papillomatosis glandular Papillomatosis NOS Papillotubular adenocarcinoma Papillotubular adenoma Paraganglioma benign Paraganglioma malignant Paraganglioma NOS Peripheral T-cell lymphoma large cell Peripheral T-cell lymphoma NOS Pigmented adenoma Pigmented basal cell carcinoma Pigmented nevus NOS Pituitary adenoma NOS Pituitary carcinoma NOS Pleomorphic adenoma Pleomorphic carcinoma Pleomorphic lipoma Pleomorphic liposarcoma Pleomorphic lobular carcinoma Pleomorphic lobular carcinoma in situ Precancerous melanosis NOS Precursor B-cell lymphoblastic leukemia Precursor B-cell lymphoblastic lymphoma Precursor cell lymphoblastic leukemia NOS Precursor T-cell lymphoblastic leukemia Precursor T-cell lymphoblastic lymphoma Preleukemia Preleukemic syndrome Primary amyloidosis Pro-B ALL Pro-T ALL Prostatic intraepithelial neoplasia grade III Pulmonary adenomatosis Pulmonary artery intimal sarcoma Pulmonary blastoma Renal carcinoma collecting duct type Renal cell adenocarcinoma Renal cell carcinoma chromophobe type Renal cell carcinoma NOS Renal cell carcinoma sarcomatoid Renal cell carcinoma spindle cell Renal cell carcinoma unclassified Renal medullary carcinoma Rhabdoid meningioma Rhabdoid sarcoma Rhabdoid tumor NOS Rhabdomyoma NOS Rhabdomyosarcoma with ganglionic differentiation Rhabdomyosarcoma NOS Rhabdosarcoma Rodent ulcer Sarcoma NOS Sclerosing hemangioma Sclerosing hepatic carcinoma Secondary carcinoma Secretory carcinoma of breast Serous cystadenocarcinoma NOS Serous surface papillary carcinoma High-grade serous carcinoma Skin appendage carcinoma Small cell carcinoma NOS Small cell neuroendocrine carcinoma Small cell osteosarcoma Small cell sarcoma Small congenital nevus Spindle cell carcinoma NOS Spindle cell melanoma NOS Splenic B-cell lymphoma/leukemia unclassifiable Splenic diffuse red pulp small B-cell lymphoma Splenic lymphoma with villous lymphocytes Splenic marginal zone B-cell lymphoma Splenic marginal zone lymphoma NOS Squamous cell carcinoma in situ NOS Squamous cell carcinoma adenoid Squamous cell carcinoma clear cell type Squamous cell carcinoma NOS T lymphoblastic leukemia/lymphoma T-cell large granular lymphocytic leukemia T-cell large granular lymphocytosis T-cell lymphoma NOS Teratoma malignant NOS Teratoma NOS Therapy related myeloid neoplasm Transitional carcinoma Transitional cell carcinoma Transitional cell carcinoma in situ Tubular adenocarcinoma Tubular adenoma NOS Tubular androblastoma with lipid storage Tubular androblastoma NOS Tubular carcinoid Tubular carcinoma Tubulo-papillary adenoma Tubulocystic renal cell carcinoma Tubulolobular carcinoma Tubulopapillary adenocarcinoma Tubulovillous adenoma NOS Tumor cells benign Tumor cells malignant Tumor cells NOS Tumor cells uncertain whether benign or malignant Tumor embolus Tumor benign Tumor malignant NOS Tumor metastatic Tumor NOS Tumor secondary Tumorlet benign Typical carcinoid Unclassified tumor benign Unclassified tumor borderline malignancy Unclassified tumor malignant Unclassified tumor malignant uncertain whether primary or metastatic Unclassified tumor uncertain whether benign or malignant Undifferentiated epithelioid sarcoma Undifferentiated high-grade pleomorphic sarcoma Undifferentiated leukaemia Undifferentiated pleomorphic sarcoma Undifferentiated round cell sarcoma Undifferentiated sarcoma Undifferentiated spindle cell sarcoma Undifferentiated uterine sarcoma unknown
Precancerous Condition Type,The classification of pre-cancerous cells found in a specific collection of data being studied by the Consortium for Molecular and Cellular Characterization of Screen-Detected Lesions (MCL).,False,,String,Ductal Carcinoma In Situ Pancreatic Intraductal Papillary-Mucinous Neoplasm Atypical Adenomatous Lung Hyperplasia Other Pancreatic Intraepithelial Neoplasia Prostatic Intraepithelial Neoplasia Melanocytic hyperplasia Atypical melanocytic proliferation Melanoma in situ Superficial spreading Lentigo maligna type Acral-lentiginous Melanoma in situ arising in a giant congenital nevus Persistent melanoma in situ Melanoma in situ not otherwise classified Scar - no residual melanoma Invasive melanoma - superficial spreading Invasive melanoma - nodular type Invasive melanoma - lentigo maligna Invasive melanoma - acral lentiginous Invasive melanoma - desmoplastic Invasive melanoma - nevoid Invasive melanoma Normal WDA Reserve cell hyperplasia Squamous metaplasia - mature Squamous metaplasia - immature Mild dysplasia Moderate dysplasia Severe dysplasia Atypical adenomatous hyperplasia Adenocarcinoma in situ - non mucinous Adenocarcinoma in situ - mucinous Benign tumor NOS Hamartoma Carcinoma NOS Normal Squamous carcinoma in situ Neuroendocrine cell hyperplasia No diagnosis possible Not Applicable
Site of Resection or Biopsy,"The text term used to describe the anatomic site of the resection or biopsy of the patient's malignant disease, as described by the World Health Organization's (WHO) International Classification of Diseases for Oncology (ICD-O).",True,"Biospecimen is ""Bone""' 'Biospecimen is ""Urine""' 'Biospecimen is ""Tissue""",String,Abdomen NOS Abdominal esophagus Accessory sinus NOS Acoustic nerve Adrenal gland NOS Ampulla of Vater Anal canal Anterior 2/3 of tongue NOS Anterior floor of mouth Anterior mediastinum Anterior surface of epiglottis Anterior wall of bladder Anterior wall of nasopharynx Anus NOS Aortic body and other paraganglia Appendix Ascending colon Autonomic nervous system NOS Axillary tail of breast Base of tongue NOS Bladder neck Bladder NOS Blood Body of pancreas Body of penis Body of stomach Bone marrow Bone of limb NOS Bone NOS Bones of skull and face and associated joints Border of tongue Brain stem Brain NOS Branchial cleft Breast NOS Broad ligament Cardia NOS Carotid body Cauda equina Cecum Central portion of breast Cerebellum NOS Cerebral meninges Cerebrum Cervical esophagus Cervix uteri Choroid Ciliary body Cloacogenic zone Colon NOS Commissure of lip Conjunctiva Connective subcutaneous and other soft tissues of abdomen Connective subcutaneous and other soft tissues of head face and neck Connective subcutaneous and other soft tissues of lower limb and hip Connective subcutaneous and other soft tissues of pelvis Connective subcutaneous and other soft tissues of thorax Connective subcutaneous and other soft tissues of trunk NOS Connective subcutaneous and other soft tissues of upper limb and shoulder Connective subcutaneous and other soft tissues NOS Cornea NOS Corpus uteri Cortex of adrenal gland Cranial nerve NOS Craniopharyngeal duct Descended testis Descending colon Dome of bladder Dorsal surface of tongue NOS Duodenum Endocervix Endocrine gland NOS Endometrium Epididymis Esophagus NOS Ethmoid sinus Exocervix External ear External lip NOS External lower lip External upper lip Extrahepatic bile duct Eye NOS Eyelid Fallopian tube Female genital tract NOS Floor of mouth NOS Frontal lobe Frontal sinus Fundus of stomach Fundus uteri Gallbladder Gastric antrum Gastrointestinal tract NOS Glans penis Glottis Greater curvature of stomach NOS Gum NOS Hard palate Head of pancreas Head face or neck NOS Heart Hematopoietic system NOS Hepatic flexure of colon Hypopharyngeal aspect of aryepiglottic fold Hypopharynx NOS Ileum Ill-defined sites within respiratory system Intestinal tract NOS Intra-abdominal lymph nodes Intrahepatic bile duct Intrathoracic lymph nodes Islets of Langerhans Isthmus uteri Jejunum Kidney NOS Labium majus Labium minus Lacrimal gland Laryngeal cartilage Larynx NOS Lateral floor of mouth Lateral wall of bladder Lateral wall of nasopharynx Lateral wall of oropharynx Lesser curvature of stomach NOS Lingual tonsil Lip NOS Liver Long bones of lower limb and associated joints Long bones of upper limb scapula and associated joints Lower gum Lower limb NOS Lower lobe lung Lower third of esophagus Lower-inner quadrant of breast Lower-outer quadrant of breast Lung NOS Lymph node NOS Lymph nodes of axilla or arm Lymph nodes of head face and neck Lymph nodes of inguinal region or leg Lymph nodes of multiple regions Main bronchus Major salivary gland NOS Male genital organs NOS Mandible Maxillary sinus Meckel diverticulum Mediastinum NOS Medulla of adrenal gland Meninges NOS Middle ear Middle lobe lung Middle third of esophagus Mouth NOS Mucosa of lip NOS Mucosa of lower lip Mucosa of upper lip Myometrium Nasal cavity Nasopharynx NOS Nervous system NOS Nipple Occipital lobe Olfactory nerve Optic nerve Orbit NOS Oropharynx NOS Other ill-defined sites Other specified parts of female genital organs Other specified parts of male genital organs Other specified parts of pancreas Ovary Overlapping lesion of accessory sinuses Overlapping lesion of bladder Overlapping lesion of bones joints and articular cartilage Overlapping lesion of bones joints and articular cartilage of limbs Overlapping lesion of brain Overlapping lesion of brain and central nervous system Overlapping lesion of breast Overlapping lesion of cervix uteri Overlapping lesion of colon Overlapping lesion of connective subcutaneous and other soft tissues Overlapping lesion of corpus uteri Overlapping lesion of digestive system Overlapping lesion of endocrine glands and related structures Overlapping lesion of esophagus Overlapping lesion of eye and adnexa Overlapping lesion of female genital organs Overlapping lesion of floor of mouth Overlapping lesion of heart mediastinum and pleura Overlapping lesion of hypopharynx Overlapping lesion of ill-defined sites Overlapping lesion of larynx Overlapping lesion of lip Overlapping lesion of lip oral cavity and pharynx Overlapping lesion of lung Overlapping lesion of major salivary glands Overlapping lesion of male genital organs Overlapping lesion of nasopharynx Overlapping lesion of other and unspecified parts of mouth Overlapping lesion of palate Overlapping lesion of pancreas Overlapping lesion of penis Overlapping lesion of peripheral nerves and autonomic nervous system Overlapping lesion of rectum anus and anal canal Overlapping lesion of respiratory system and intrathoracic organs Overlapping lesion of retroperitoneum and peritoneum Overlapping lesion of skin Overlapping lesion of small intestine Overlapping lesion of stomach Overlapping lesion of tongue Overlapping lesion of tonsil Overlapping lesion of urinary organs Overlapping lesion of vulva Overlapping lesions of oropharynx Palate NOS Pancreas NOS Pancreatic duct Parametrium Paraspinal Parathyroid gland Paraurethral gland Parietal lobe Parotid gland Pelvic bones sacrum coccyx and associated joints Pelvic lymph nodes Pelvis NOS Penis NOS Peripheral nerves and autonomic nervous system of abdomen Peripheral nerves and autonomic nervous system of head face and neck Peripheral nerves and autonomic nervous system of lower limb and hip Peripheral nerves and autonomic nervous system of pelvis Peripheral nerves and autonomic nervous system of thorax Peripheral nerves and autonomic nervous system of trunk NOS Peripheral nerves and autonomic nervous system of upper limb and shoulder Peritoneum NOS Pharynx NOS Pineal gland Pituitary gland Placenta Pleura NOS Postcricoid region Posterior mediastinum Posterior wall of bladder Posterior wall of hypopharynx Posterior wall of nasopharynx Posterior wall of oropharynx Prepuce Prostate gland Pylorus Pyriform sinus Rectosigmoid junction Rectum NOS Renal pelvis Reticuloendothelial system NOS Retina Retromolar area Retroperitoneum Rib sternum clavicle and associated joints Round ligament Scrotum NOS Short bones of lower limb and associated joints Short bones of upper limb and associated joints Sigmoid colon Skin of lip NOS skin of lower limb and hip Skin of other and unspecified parts of face Skin of scalp and neck Skin of trunk skin of upper limb and shoulder skin NOS Small intestine NOS Soft palate NOS Specified parts of peritoneum Spermatic cord Sphenoid sinus Spinal cord Spinal meninges Spleen Splenic flexure of colon Stomach NOS Subglottis Sublingual gland Submandibular gland Superior wall of nasopharynx Supraglottis Tail of pancreas Temporal lobe Testis NOS Thoracic esophagus Thorax NOS Thymus Thyroid gland Tongue NOS Tonsil NOS Tonsillar fossa Tonsillar pillar Trachea Transverse colon Trigone of bladder Undescended testis unknown primary site Upper gum Upper limb NOS Upper lobe lung Upper respiratory tract NOS Upper third of esophagus Upper-inner quadrant of breast Upper-outer quadrant of breast Urachus Ureter Ureteric orifice Urethra Urinary system NOS Uterine adnexa Uterus NOS Uvula Vagina NOS Vallecula Ventral surface of tongue NOS Ventricle NOS Vertebral column Vestibule of mouth Vulva NOS Waldeyer ring Biliary tract NOS Cheek mucosa Clitoris Overlapping lesion of biliary tract unknown Not Reported
