Attribute,Description,Required,Conditional If,Data Type,Valid Values
Tissue or Organ of Origin,"The text term used to describe the anatomic site of origin, of the patient's malignant disease, as described by the World Health Organization's (WHO) International Classification of Diseases for Oncology (ICD-O).",True,,String,Abdomen NOS Abdominal esophagus Accessory sinus NOS Acoustic nerve Adrenal gland NOS Ampulla of Vater Anal canal Anterior 2/3 of tongue NOS Anterior floor of mouth Anterior mediastinum Anterior surface of epiglottis Anterior wall of bladder Anterior wall of nasopharynx Anus NOS Aortic body and other paraganglia Appendix Ascending colon Autonomic nervous system NOS Axillary tail of breast Base of tongue NOS Bladder neck Bladder NOS Blood Body of pancreas Body of penis Body of stomach Bone marrow Bone of limb NOS Bone NOS Bones of skull and face and associated joints Border of tongue Brain stem Brain NOS Branchial cleft Breast NOS Broad ligament Cardia NOS Carotid body Cauda equina Cecum Central portion of breast Cerebellum NOS Cerebral meninges Cerebrum Cervical esophagus Cervix uteri Choroid Ciliary body Cloacogenic zone Colon NOS Commissure of lip Conjunctiva Connective subcutaneous and other soft tissues of abdomen Connective subcutaneous and other soft tissues of head face and neck Connective subcutaneous and other soft tissues of lower limb and hip Connective subcutaneous and other soft tissues of pelvis Connective subcutaneous and other soft tissues of thorax Connective subcutaneous and other soft tissues of trunk NOS Connective subcutaneous and other soft tissues of upper limb and shoulder Connective subcutaneous and other soft tissues NOS Cornea NOS Corpus uteri Cortex of adrenal gland Cranial nerve NOS Craniopharyngeal duct Descended testis Descending colon Dome of bladder Dorsal surface of tongue NOS Duodenum Endocervix Endocrine gland NOS Endometrium Epididymis Esophagus NOS Ethmoid sinus Exocervix External ear External lip NOS External lower lip External upper lip Extrahepatic bile duct Eye NOS Eyelid Fallopian tube Female genital tract NOS Floor of mouth NOS Frontal lobe Frontal sinus Fundus of stomach Fundus uteri Gallbladder Gastric antrum Gastrointestinal tract NOS Glans penis Glottis Greater curvature of stomach NOS Gum NOS Hard palate Head of pancreas Head face or neck NOS Heart Hematopoietic system NOS Hepatic flexure of colon Hypopharyngeal aspect of aryepiglottic fold Hypopharynx NOS Ileum Ill-defined sites within respiratory system Intestinal tract NOS Intra-abdominal lymph nodes Intrahepatic bile duct Intrathoracic lymph nodes Islets of Langerhans Isthmus uteri Jejunum Kidney NOS Labium majus Labium minus Lacrimal gland Laryngeal cartilage Larynx NOS Lateral floor of mouth Lateral wall of bladder Lateral wall of nasopharynx Lateral wall of oropharynx Lesser curvature of stomach NOS Lingual tonsil Lip NOS Liver Long bones of lower limb and associated joints Long bones of upper limb scapula and associated joints Lower gum Lower limb NOS Lower lobe lung Lower third of esophagus Lower-inner quadrant of breast Lower-outer quadrant of breast Lung NOS Lymph node NOS Lymph nodes of axilla or arm Lymph nodes of head face and neck Lymph nodes of inguinal region or leg Lymph nodes of multiple regions Main bronchus Major salivary gland NOS Male genital organs NOS Mandible Maxillary sinus Meckel diverticulum Mediastinum NOS Medulla of adrenal gland Meninges NOS Middle ear Middle lobe lung Middle third of esophagus Mouth NOS Mucosa of lip NOS Mucosa of lower lip Mucosa of upper lip Myometrium Nasal cavity Nasopharynx NOS Nervous system NOS Nipple Occipital lobe Olfactory nerve Optic nerve Orbit NOS Oropharynx NOS Other ill-defined sites Other specified parts of female genital organs Other specified parts of male genital organs Other specified parts of pancreas Ovary Overlapping lesion of accessory sinuses Overlapping lesion of bladder Overlapping lesion of bones joints and articular cartilage Overlapping lesion of bones joints and articular cartilage of limbs Overlapping lesion of brain Overlapping lesion of brain and central nervous system Overlapping lesion of breast Overlapping lesion of cervix uteri Overlapping lesion of colon Overlapping lesion of connective subcutaneous and other soft tissues Overlapping lesion of corpus uteri Overlapping lesion of digestive system Overlapping lesion of endocrine glands and related structures Overlapping lesion of esophagus Overlapping lesion of eye and adnexa Overlapping lesion of female genital organs Overlapping lesion of floor of mouth Overlapping lesion of heart mediastinum and pleura Overlapping lesion of hypopharynx Overlapping lesion of ill-defined sites Overlapping lesion of larynx Overlapping lesion of lip Overlapping lesion of lip oral cavity and pharynx Overlapping lesion of lung Overlapping lesion of major salivary glands Overlapping lesion of male genital organs Overlapping lesion of nasopharynx Overlapping lesion of other and unspecified parts of mouth Overlapping lesion of palate Overlapping lesion of pancreas Overlapping lesion of penis Overlapping lesion of peripheral nerves and autonomic nervous system Overlapping lesion of rectum anus and anal canal Overlapping lesion of respiratory system and intrathoracic organs Overlapping lesion of retroperitoneum and peritoneum Overlapping lesion of skin Overlapping lesion of small intestine Overlapping lesion of stomach Overlapping lesion of tongue Overlapping lesion of tonsil Overlapping lesion of urinary organs Overlapping lesion of vulva Overlapping lesions of oropharynx Palate NOS Pancreas NOS Pancreatic duct Parametrium Paraspinal Parathyroid gland Paraurethral gland Parietal lobe Parotid gland Pelvic bones sacrum coccyx and associated joints Pelvic lymph nodes Pelvis NOS Penis NOS Peripheral nerves and autonomic nervous system of abdomen Peripheral nerves and autonomic nervous system of head face and neck Peripheral nerves and autonomic nervous system of lower limb and hip Peripheral nerves and autonomic nervous system of pelvis Peripheral nerves and autonomic nervous system of thorax Peripheral nerves and autonomic nervous system of trunk NOS Peripheral nerves and autonomic nervous system of upper limb and shoulder Peritoneum NOS Pharynx NOS Pineal gland Pituitary gland Placenta Pleura NOS Postcricoid region Posterior mediastinum Posterior wall of bladder Posterior wall of hypopharynx Posterior wall of nasopharynx Posterior wall of oropharynx Prepuce Prostate gland Pylorus Pyriform sinus Rectosigmoid junction Rectum NOS Renal pelvis Reticuloendothelial system NOS Retina Retromolar area Retroperitoneum Rib sternum clavicle and associated joints Round ligament Scrotum NOS Short bones of lower limb and associated joints Short bones of upper limb and associated joints Sigmoid colon Skin of lip NOS skin of lower limb and hip Skin of other and unspecified parts of face Skin of scalp and neck Skin of trunk skin of upper limb and shoulder skin NOS Small intestine NOS Soft palate NOS Specified parts of peritoneum Spermatic cord Sphenoid sinus Spinal cord Spinal meninges Spleen Splenic flexure of colon Stomach NOS Subglottis Sublingual gland Submandibular gland Superior wall of nasopharynx Supraglottis Tail of pancreas Temporal lobe Testis NOS Thoracic esophagus Thorax NOS Thymus Thyroid gland Tongue NOS Tonsil NOS Tonsillar fossa Tonsillar pillar Trachea Transverse colon Trigone of bladder Undescended testis unknown primary site Upper gum Upper limb NOS Upper lobe lung Upper respiratory tract NOS Upper third of esophagus Upper-inner quadrant of breast Upper-outer quadrant of breast Urachus Ureter Ureteric orifice Urethra Urinary system NOS Uterine adnexa Uterus NOS Uvula Vagina NOS Vallecula Ventral surface of tongue NOS Ventricle NOS Vertebral column Vestibule of mouth Vulva NOS Waldeyer ring Biliary tract NOS Cheek mucosa Clitoris Overlapping lesion of biliary tract unknown Not Reported
Morphology,"The third edition of the International Classification of Diseases for Oncology, published in 2000 used principally in tumor and cancer registries for coding the site (topography) and the histology (morphology) of neoplasms. The study of the structure of the cells and their arrangement to constitute tissues and, finally, the association among these to form organs. In pathology, the microscopic process of identifying normal and abnormal morphologic characteristics in tissues, by employing various cytochemical and immunocytochemical stains. A system of numbered categories for representation of data.",True,,String,
Tumor Grade,"Numeric value to express the degree of abnormality of cancer cells, a measure of differentiation and aggressiveness.",False,,String,G1 G2 G3 G4 GX GB High Grade Intermediate Grade Low Grade unknown Not Reported Not Applicable
Progression or Recurrence,Yes/No/unknown indicator to identify whether a patient has had a new tumor event after initial treatment.,True,,String,Yes - Progression or Recurrence no unknown Not Reported
Last Known Disease Status,Text term that describes the last known state or condition of an individual's neoplasm.,True,,String,Distant met recurrence/progression Loco-regional recurrence/progression Biochemical evidence of disease without structural correlate Tumor free unknown tumor status With tumor Not Reported Not Allowed To Collect Not Applicable
Days to Last Follow up,"Time interval from the date of last follow up to the date of initial pathologic diagnosis, represented as a calculated number of days. If not applicable please enter 'Not Applicable'",True,,String,
Days to Last Known Disease Status,"Time interval from the date of last follow up to the date of initial pathologic diagnosis, represented as a calculated number of days. If not applicable please enter 'Not Applicable'",True,,String,
Method of Diagnosis,Text term used to describe the method used to confirm the patients malignant diagnosis.,False,,String,Autopsy Biopsy Blood Draw Bone Marrow Aspirate Core Biopsy Cytology Cystoscopy Debulking Diagnostic Imaging Dilation and Curettage Procedure Enucleation Excisional Biopsy Fine Needle Aspiration Incisional Biopsy Laparoscopy Laparotomy Other Pap Smear Physical Exam Pathologic Review Surgical Resection Thoracentesis Ultrasound Guided Biopsy unknown Not Reported
Prior Malignancy,The yes/no/unknown indicator used to describe the patient's history of prior cancer diagnosis.,False,,String,yes no unknown Not Reported Not Allowed To Collect
Prior Treatment,A yes/no/unknown/not applicable indicator related to the administration of therapeutic agents received before the body specimen was collected.,False,,String,yes no unknown Not Reported Not Allowed To Collect
Metastasis at Diagnosis,The text term used to describe the extent of metastatic disease present at diagnosis.,False,,String,Distant Metastasis Metastasis NOS No Metastasis Regional Metastasis unknown Not Reported
Metastasis at Diagnosis Site,Text term to identify an anatomic site in which metastatic disease involvement is found.,False,,String,Abdomen Adrenal Gland Ascites Bone Bone Marrow Brain Cerebrospinal Fluid Central Nervous System Colon Distant Nodes Distant Organ Groin Kidney Liver Lung Lymph Node Axillary Inguinal Lymph Node NOS Mediastinum Omentum Ovary Pelvis Peritoneal Cavity Peritoneum Pleura Scalp Skin Small Intestine Soft Tissue Spinal Cord unknown Not Reported
First Symptom Prior to Diagnosis,Text term used to describe the patient's first symptom experienced prior to diagnosis and thought to be related to the disease.,False,,String,Altered Mental Status Headaches Motor or Movement Changes Seizures Sensory Changes Visual Changes unknown Not Reported
Days to Diagnosis,Number of days between the date used for index and the date the patient was diagnosed with the malignant disease. If not applicable please enter 'Not Applicable',False,,String,
Percent Tumor Invasion,The percentage of tumor cells spread locally in a malignant neoplasm through infiltration or destruction of adjacent tissue.,False,,String,
Residual Disease,Text terms to describe the status of a tissue margin following surgical resection.,False,,String,R0 R1 R2 RX unknown Not Reported
Synchronous Malignancy,"A yes/no/unknown indicator used to describe whether the patient had an additional malignant diagnosis at the same time the tumor used for sequencing was diagnosed. If both tumors were sequenced, both tumors would have synchronous malignancies.",False,,String,yes no unknown Not Reported
Tumor Confined to Organ of Origin,The yes/no/unknown indicator used to describe whether the tumor is confined to the organ where it originated and did not spread to a proximal or distant location within the body.,False,,String,yes no unknown Not Reported
Tumor Focality,The text term used to describe whether the patient's disease originated in a single location or multiple locations.,False,,String,Multifocal Unifocal unknown Not Reported
Tumor Largest Dimension Diameter,"Numeric value used to describe the maximum diameter or dimension of the primary tumor, measured in centimeters.",False,,String,
Gross Tumor Weight,"Numeric value used to describe the gross pathologic tumor weight, measured in grams.",False,,String,
Breslow Thickness,"The number that describes the distance, in millimeters, between the upper layer of the epidermis and the deepest point of tumor penetration.",False,,String,
Vascular Invasion Present,The yes/no indicator to ask if large vessel or venous invasion was detected by surgery or presence in a tumor specimen.,False,,String,Yes - Vascular Invasion Present no unknown Not Reported Not Allowed To Collect
Vascular Invasion Type,Text term that represents the type of vascular tumor invasion.,False,,String,Extramural Intramural Macro Micro No Vascular Invasion unknown Not Reported
Anaplasia Present,Yes/no/unknown/Not Reported indicator used to describe whether anaplasia was present at the time of diagnosis.,False,,String,Yes - Anaplasia Present no unknown Not Reported
Anaplasia Present Type,"The text term used to describe the morphologic findings indicating the presence of a malignant cellular infiltrate characterized by the presence of large pleomorphic cells, necrosis, and high mitotic activity in a tissue sample.",False,,String,Absent Diffuse Equivocal Focal Present Sclerosis unknown Not Reported
Laterality,"For tumors in paired organs, designates the side on which the cancer originates.",False,,String,Bilateral Left Midline Right Unilateral unknown Not Reported
Perineural Invasion Present,A yes/no indicator to ask if perineural invasion or infiltration of tumor or cancer is present.,False,,String,yes no unknown Not Reported
Lymphatic Invasion Present,"A yes/no indicator to ask if small or thin-walled vessel invasion is present, indicating lymphatic involvement",False,,String,yes no unknown Not Reported
Lymph Nodes Positive,The number of lymph nodes involved with disease as determined by pathologic examination.,False,,String,
Lymph Nodes Tested,The number of lymph nodes tested to determine whether lymph nodes were involved with disease as determined by a pathologic examination.,False,,String,
Peritoneal Fluid Cytological Status,The text term used to describe the malignant status of the peritoneal fluid determined by cytologic testing.,False,,String,Atypical Malignant Non-Malignant Unsatisfactory unknown Not Reported
Classification of Tumor,Text that describes the kind of disease present in the tumor specimen as related to a specific timepoint.,False,,String,Primary Metastasis Recurrence Other unknown Not Reported Not Allowed To Collect
Best Overall Response,The best improvement achieved throughout the entire course of protocol treatment.,False,,String,AJ-Adjuvant Therapy CPD-Clinical Progression CR-Complete Response CRU-Complete Response Unconfirmed DU-Disease Unchanged IMR-Immunoresponse IPD-Immunoprogression MR-Minimal/Marginal Response MX-Mixed Response Non-CR/Non-PD-Non-CR/Non-PD NPB-No Palliative Benefit NR-No Response PA-Palliative Therapy PB-Palliative Benefit PD-Progressive Disease PPD-Pseudoprogression PR-Partial Response PSR-Pseudoresponse RD-Responsive Disease RP-Response RPD-Radiographic Progressive Disease sCR-Stringent Complete Response SD-Stable Disease SPD-Surgical Progression TE-Too Early VGPR-Very Good Partial Response
Mitotic Count,"The number of mitoses identified under the microscope in tumors. The method of counting varies, according to the specific tumor examined. Usually, the mitotic count is determined based on the number of mitoses per high power field (40X) or 10 high power fields.",False,,String,
AJCC Clinical M,Extent of the distant metastasis for the cancer based on evidence obtained from clinical assessment parameters determined prior to treatment.,False,,String,M0 M1 M1a M1b M1c MX cM0 (i+) unknown Not Reported
AJCC Clinical N,Extent of the regional lymph node involvement for the cancer based on evidence obtained from clinical assessment parameters determined prior to treatment.,False,,String,N0 N0 (i+) N0 (i-) N0 (mol+) N0 (mol-) N1 N1a N1b N1bI N1bII N1bIII N1bIV N1c N1mi N2 N2a N2b N2c N3 N3a N3b N3c N4 NX unknown Not Reported
AJCC Clinical Stage,"Stage group determined from clinical information on the tumor (T), regional node (N) and metastases (M) and by grouping cases with similar prognosis for cancer.",False,,String,Stage 0 Stage 0a Stage 0is Stage I Stage IA Stage IA1 Stage IA2 Stage IB Stage IB1 Stage IB2 Stage IC Stage II Stage IIA Stage IIA1 Stage IIA2 Stage IIB Stage IIC Stage IIC1 Stage III Stage IIIA Stage IIIB Stage IIIC Stage IIIC1 Stage IIIC2 Stage IS Stage IV Stage IVA Stage IVB Stage IVC Stage Tis Stage X unknown Not Reported
AJCC Clinical T,Extent of the primary cancer based on evidence obtained from clinical assessment parameters determined prior to treatment.,False,,String,T0 T1 T1a T1a1 T1a2 T1b T1b1 T1b2 T1c T1mi T2 T2a T2a1 T2a2 T2b T2c T2d T3 T3a T3b T3c T3d T4 T4a T4b T4c T4d T4e TX Ta Tis Tis (DCIS) Tis (LCIS) Tis (Paget's) unknown Not Reported
AJCC Pathologic M,"Code to represent the defined absence or presence of distant spread or metastases (M) to locations via vascular channels or lymphatics beyond the regional lymph nodes, using criteria established by the American Joint Committee on Cancer (AJCC).",False,,String,M0 M1 M1a M1b M1c MX cM0 (i+) unknown Not Reported
AJCC Pathologic N,The codes that represent the stage of cancer based on the nodes present (N stage) according to criteria based on multiple editions of the AJCC's Cancer Staging Manual.,False,,String,N0 N0 (i+) N0 (i-) N0 (mol+) N0 (mol-) N1 N1a N1b N1bI N1bII N1bIII N1bIV N1c N1mi N2 N2a N2b N2c N3 N3a N3b N3c N4 NX unknown Not Reported
AJCC Pathologic Stage,"The extent of a cancer, especially whether the disease has spread from the original site to other parts of the body based on AJCC staging criteria.",False,,String,Stage 0 Stage 0a Stage 0is Stage I Stage IA Stage IA1 Stage IA2 Stage IB Stage IB1 Stage IB2 Stage IC Stage II Stage IIA Stage IIA1 Stage IIA2 Stage IIB Stage IIC Stage IIC1 Stage III Stage IIIA Stage IIIB Stage IIIC Stage IIIC1 Stage IIIC2 Stage IS Stage IV Stage IVA Stage IVB Stage IVC Stage Tis Stage X unknown Not Reported
AJCC Pathologic T,"Code of pathological T (primary tumor) to define the size or contiguous extension of the primary tumor (T), using staging criteria from the American Joint Committee on Cancer (AJCC).",False,,String,T0 T1 T1a T1a1 T1a2 T1b T1b1 T1b2 T1c T1mi T2 T2a T2a1 T2a2 T2b T2c T2d T3 T3a T3b T3c T3d T4 T4a T4b T4c T4d T4e TX Ta Tis Tis (DCIS) Tis (LCIS) Tis (Paget's) unknown Not Reported
AJCC Staging System Edition,"The text term used to describe the version or edition of the American Joint Committee on Cancer Staging Handbooks, a publication by the group formed for the purpose of developing a system of staging for cancer that is acceptable to the American medical profession and is compatible with other accepted classifications.",False,,String,1st 2nd 3rd 4th 5th 6th 7th 8th unknown Not Reported
Cog Neuroblastoma Risk Group,Text term that represents the categorization of patients on the basis of prognostic factors per a system developed by Children's Oncology Group (COG). Risk level is used to assign treatment intensity.,False,,String,High Risk Intermediate Risk Low Risk unknown Not Reported
Cog Rhabdomyosarcoma Risk Group,"Text term used to describe the classification of rhabdomyosarcoma, as defined by the Children's Oncology Group (COG).",False,,String,High Risk Intermediate Risk Low Risk unknown Not Reported
Gleason Grade Group,"The text term used to describe the overall grouping of grades defined by the Gleason grading classification, which is used to determine the aggressiveness of prostate cancer. Note that this grade describes the entire prostatectomy specimen and is not specific to the sample used for sequencing.",False,,String,Group 1 Group 2 Group 3 Group 4 Group 5
Gleason Grade Tertiary,The text term used to describe the tertiary pattern as described by the Gleason Grading System.,False,,String,Pattern 4 Pattern 5
Gleason Patterns Percent,"Numeric value that represents the percentage of Patterns 4 and 5, which is used when the Gleason score is greater than 7 to predict prognosis.",False,,String,
Greatest Tumor Dimension,Numeric value that represents the measurement of the widest portion of the tumor in centimeters.,False,,String,
IGCCCG Stage,"The text term used to describe the International Germ Cell Cancer Collaborative Group (IGCCCG), a grouping used to further classify metastatic testicular tumors.",False,,String,Good Prognosis Intermediate Prognosis Poor Prognosis unknown Not Reported
INPC Grade,"Text term used to describe the classification of neuroblastic differentiation within neuroblastoma tumors, as defined by the International Neuroblastoma Pathology Classification (INPC).",False,,String,Differentiating Poorly Differentiated Undifferentiated unknown Not Reported
INPC Histologic Group,"The text term used to describe the classification of neuroblastomas distinguishing between favorable and unfavorable histologic groups. The histologic score, defined by the International Neuroblastoma Pathology Classification (INPC), is based on age, mitosis-karyorrhexis index (MKI), stromal content and degree of tumor cell differentiation.",False,,String,Favorable Unfavorable unknown Not Reported
INRG Stage,"The text term used to describe the staging classification of neuroblastic tumors, as defined by the International Neuroblastoma Risk Group (INRG).",False,,String,L1 L2 M Ms unknown Not Reported
INSS Stage,"Text term used to describe the staging classification of neuroblastic tumors, as defined by the International Neuroblastoma Staging System (INSS).",False,,String,Stage 1 Stage 2A Stage 2B Stage 3 Stage 4 Stage 4S unknown Not Reported
International Prognostic Index,"The text term used to describe the International Prognostic Index, which classifies the prognosis of patients with aggressive non-Hodgkin's lymphoma.",False,,String,Low Risk Low-Intermediate Risk High-Intermediate Risk High Risk
IRS Group,"Text term used to describe the classification of rhabdomyosarcoma tumors, as defined by the Intergroup Rhabdomyosarcoma Study (IRS).",False,,String,Group I Group Ia Group Ib Group II Group IIa Group IIc Group III Group IIIa Group IIIb Group IV unknown Not Reported
IRS Stage,"The text term used to describe the classification of rhabdomyosarcoma tumors, as defined by the Intergroup Rhabdomyosarcoma Study (IRS).",False,,String,1 2 3 4 unknown Not Reported
ISS Stage,The multiple myeloma disease stage at diagnosis.,False,,String,I II III Not Reported unknown
Lymph Node Involved Site,The text term used to describe the anatomic site of lymph node involvement.,False,,String,Axillary Cervical Epitrochlear Femoral Hilar Iliac-common Iliac-external Iliac NOS Inguinal Mediastinal Mesenteric None Occipital Paraaortic Parotid Popliteal Retroperitoneal Splenic Submandibular Supraclavicular unknown Not Reported
Margin Distance,Numeric value (in centimeters) that represents the distance between the tumor and the surgical margin.,False,,String,
Margins Involved Site,The text term used to describe the anatomic sites that were involved in the survival margins.,False,,String,Gerota Fascia Parenchyma Perinephric Fat Renal Renal Capsule Renal Sinus Renal Vein Ureter
Medulloblastoma Molecular Classification,The text term used to describe the classification of medulloblastoma tumors based on molecular features.,False,,String,Not Determined Non-WNT/non-SHH Activated SHH-Activated WNT-Activated unknown Not Reported
Micropapillary Features,The yes/no/unknown indicator used to describe whether micropapillary features were determined to be present.,False,,String,Absent Present unknown Not Reported
Mitosis Karyorrhexis Index,Text term that represents the component of the International Neuroblastoma Pathology Classification (INPC) for mitosis-karyorrhexis index (MKI).,False,,String,High Intermediate Low unknown Not Reported
Non Nodal Regional Disease,The text term used to describe whether the patient had non-nodal regional disease.,False,,String,Absent Indeterminate Present unknown Not Reported
Non Nodal Tumor Deposits,The yes/no/unknown indicator used to describe the presence of tumor deposits in the pericolic or perirectal fat or in adjacent mesentery away from the leading edge of the tumor.,False,,String,yes no unknown Not Reported
Ovarian Specimen Status,The text term used to describe the physical condition of the involved ovary.,False,,String,Ovarian Capsule Intact Ovarian Capsule Ruptured Ovarian Capsule Fragmented unknown Not Reported
Ovarian Surface Involvement,The text term that describes whether the surface tissue (outer boundary) of the ovary shows evidence of involvement or presence of cancer.,False,,String,Absent Present Indeterminate unknown Not Reported
