Attribute,Description,Required,Conditional If,Data Type,Valid Values
Pregnant at Diagnosis,The text term used to indicate whether the patient was pregnant at the time they were diagnosed.,False,,String,yes no unknown Not Reported
Primary Gleason Grade,"The text term used to describe the primary Gleason score, which describes the pattern of cells making up the largest area of the tumor. The primary and secondary Gleason pattern grades are combined to determine the patient's Gleason grade group, which is used to determine the aggresiveness of prostate cancer. Note that this grade describes the entire prostatectomy specimen and is not specific to the sample used for sequencing.",False,,String,Pattern 1 Pattern 2 Pattern 3 Pattern 4 Pattern 5
Secondary Gleason Grade,"The text term used to describe the secondary Gleason score, which describes the pattern of cells making up the second largest area of the tumor. The primary and secondary Gleason pattern grades are combined to determine the patient's Gleason grade group, which is used to determine the aggresiveness of prostate cancer. Note that this grade describes the entire prostatectomy specimen and is not specific to the sample used for sequencing.",False,,String,Pattern 1 Pattern 2 Pattern 3 Pattern 4 Pattern 5
Supratentorial Localization,Text term to specify the location of the supratentorial tumor.,False,,String,Cerebral Cortex Deep Gray Spinal Cord White Matter unknown Not Reported
Tumor Depth,"Numeric value that represents the depth of tumor invasion, measured in millimeters (mm).",False,,String,
WHO CNS Grade,WHO CNS Grade,False,,String,Grade I Grade II Grade III Grade IV Grade Not Assigned unknown Not Reported
WHO NTE Grade,WHO NTE Grade,False,,String,G1 G2 G3 GX unknown Not Reported
Sentinel Lymph Node Count,Numeric count of sentinel lymph nodes.,False,,String,
Sentinel Node Positive Assessment Count,The number or amount of metastatic neoplasms related to the confirmed presence of disease or specific microorganisms during examination of the first rounded mass of lymphatic tissue to which cancer is likely to spread from the primary tumor.,False,,String,
Tumor Extranodal Extension Indicator,The indicator to determine extranodal involvement or extent of the disease.,False,,String,Absent Indeterminate NO YES No source documentation Not applicable Not sampled or dissected Present Present - extensive Present - minimal UNKNOWN Unspecified
Satellite Metastasis Present Indicator,A yes/no indicator to ask if intransit metastases or satellite lesions are present.,False,,String,yes no unknown
Other Biopsy Resection Site,A description of the location on or within the human body where the surgical biopsy/resection procedure was performed (Not covered under HTAN Clinical Data Tier 1),False,,String,
Extent of Tumor Resection,"The degree to which the lesion has been cut out, or resected.",False,,String,Gross Total Resection Open Biopsy Subtotal Resection Extensive Subtotal Minor Optimal debulking Other Partial debulking Segmental Suboptimal Suboptimal debulking NTR unknown Not Reported Not Applicable
Mode of Cancer Detection,"Text term used to describe the mode of cancer detection, like standard of care screening or random detection",False,,String,Standard of Care Screening Clinical Examination of unrelated cancer symptoms Incidentaloma Interval Cancer Data not available
NCI Atlas Cancer Site,"The primary tumor site used to calculate the incidence rate using the NCI Cancer Atlas, a digital atlas which provides geographical data related to cancer utilizing the Surveillance, Epidemiology, and End Results (SEER) Program cancer incidence rates for 2013 to 2017",False,,String,Bladder Brain And Other Nervous System Female Breast In situ Female Breast Cervix Uteri Less Than Age Malignant Childhood Neoplasm Colon And Rectum Esophagus Kidney And Renal Pelvis Leukemia Liver And Bile Duct Lung And Bronchus Cutaneous Melanoma Non-Hodgkin's Lymphoma Oral Cavity And Pharynx Ovary Pancreas Prostate Gland Stomach Thyroid Gland Uterus
Topography Code,"Topography Code, indicating site within the body, based on ICD-O-3.",False,,String,C00.0 C00.1 C00.2 C00.3 C00.4 C00.5 C00.6 C00.8 C01.9 C02.0 C02.1 C02.2 C02.3 C02.4 C02.8 C02.9 C03.0 C03.1 C03.9 C04.0 C04.1 C04.8 C04.9 C05.0 C05.1 C05.2 C05.8 C05.9 C06.0 C06.1 C06.2 C06.8 C06.9 C07.9 C08.0 C08.1 C08.8 C08.9 C09.0 C09.1 C09.8 C09.9 C10.0 C10.1 C10.2 C10.3 C10.4 C10.8 C10.9 C11.0 C11.1 C11.2 C11.3 C11.8 C11.9 C12.9 C13.0 C13.1 C13.2 C13.8 C13.9 C14.0 C14.2 C14.8 C15.0 C15.1 C15.2 C15.3 C15.4 C15.5 C15.8 C15.9 C16.0 C16.1 C16.2 C16.3 C16.4 C16.5 C16.6 C16.8 C16.9 C17.0 C17.1 C17.2 C17.3 C17.8 C17.9 C18.0 C18.1 C18.2 C18.3 C18.4 C18.5 C18.6 C18.7 C18.8 C18.9 C19.9 C20.9 C21.0 C21.1 C21.2 C21.8 C22.0 C22.1 C23.9 C24.0 C24.1 C24.8 C24.9 C25.0 C25.1 C25.2 C25.3 C25.4 C25.7 C25.8 C25.9 C26.0 C26.8 C26.9 C30.0 C30.1 C31.0 C31.1 C31.2 C31.3 C31.8 C31.9 C32.0 C32.1 C32.2 C32.3 C32.8 C32.9 C33.9 C34.0 C34.1 C34.2 C34.3 C34.8 C34.9 C37.9 C38.0 C38.1 C38.2 C38.3 C38.4 C38.8 C39.0 C39.8 C39.9 C40.0 C40.1 C40.3 C40.8 C40.9 C41.0 C41.1 C41.2 C41.3 C41.4 C41.8 C41.9 C42.0 C42.1 C42.2 C42.3 C42.4 C44.0 C44.1 C44.2 C44.3 C44.4 C44.5 C44.6 C44.7 C47.0 C47.1 C47.2 C47.3 C47.4 C47.5 C47.6 C47.8 C47.9 C48.0 C48.1 C48.2 C48.8 C49.0 C49.1 C49.2 C49.3 C49.4 C49.5 C49.6 C49.8 C49.9 C50.0 C50.1 C50.2 C50.3 C50.4 C50.5 C50.6 C50.8 C50.9 C51.0 C51.1 C51.2 C51.8 C51.9 C52.9 C53.0 C53.1 C53.8 C53.9 C54.0 C54.1 C54.2 C54.3 C54.8 C54.9 C55.9 C56.9 C57.0 C57.1 C57.2 C57.3 C57.4 C57.7 C57.8 C57.9 C60.0 C60.1 C60.2 C60.8 C60.9 C61.9 C62.0 C62.1 C62.9 C63.0 C63.1 C63.2 C63.7 C63.8 C63.9 C64.9 C65.9 C66.9 C67.0 C67.1 C67.2 C67.4 C67.6 C67.7 C67.8 C67.9 C68.0 C68.1 C68.8 C68.9 C69.0 C69.1 C69.2 C69.3 C69.4 C69.5 C69.6 C69.8 C69.9 C70.0 C70.1 C70.9 C71.0 C71.1 C71.2 C71.3 C71.4 C71.5 C71.6 C71.7 C71.8 C71.9 C72.0 C72.1 C72.2 C72.3 C72.4 C72.5 C72.8 C72.9 C73.9 C74.0 C74.1 C74.9 C75.0 C75.1 C75.2 C75.3 C75.4 C75.5 C75.8 C75.9 C76.0 C76.1 C76.2 C76.3 C76.4 C76.5 C76.7 C76.8 C77.0 C77.1 C77.2 C77.3 C77.4 C77.5 C77.8 C77.9 C80.9 unknown Not Reported
Additional Topography,Topography not included in the ICD-O-3 Topography codes.,False,,String,skin of scalp skin of eye lid skin of nose skin of lip skin of ear skin of neck skin of other parts of face skin of chest skin of back skin of abdomen Skin of trunk skin of breast skin of upper limb and shoulder skin of palm skin of lower limb and hip skin of sole skin of penis skin of scrotum skin of vulva skin NOS Hilar Airway Peri-tumoral Airway Not Reported
Days to Progression,Number of days between the date used for index and the date the patient's disease progressed. If not applicable please enter 'Not Applicable',False,"Progression or Recurrence is ""Yes - Progression or Recurrence""",String,
Days to Progression Free,Number of days between the date used for index and the date the patient's disease was formally confirmed as progression-free. If not applicable please enter 'Not Applicable',False,"Progression or Recurrence is ""Yes - Progression or Recurrence""",String,
Yes - Progression or Recurrence,The patient has had a new tumor event after initial treatment,False,,String,
Progression or Recurrence Type,The text term used to describe the type of progressive or recurrent disease or relapsed disease.,False,"Progression or Recurrence is ""Yes - Progression or Recurrence""",String,Biochemical Distant Local Regional unknown Not Reported
Yes - Anaplasia Present,Indicates anaplasia is present,False,,String,
Yes - Vascular Invasion Present,Indicates venous invasion was detected by surgery or presence in a tumor specimen,False,,String,
Days to Recurrence,Number of days between the date used for index and the date the patient's disease recurred. If not applicable please enter 'Not Applicable',True,"Progression or Recurrence is ""Yes - Progression or Recurrence""",String,
Progression or Recurrence Anatomic Site,The text term used to describe the anatomic site of resection; biopsy; tissue or organ of biospecimen origin; progression or recurrent disease; treatment,False,"Progression or Recurrence is ""Yes - Progression or Recurrence""",String,Abdomen NOS Abdominal esophagus Accessory sinus NOS Acoustic nerve Adrenal gland NOS Ampulla of Vater Anal canal Anterior 2/3 of tongue NOS Anterior floor of mouth Anterior mediastinum Anterior surface of epiglottis Anterior wall of bladder Anterior wall of nasopharynx Anus NOS Aortic body and other paraganglia Appendix Ascending colon Autonomic nervous system NOS Axillary tail of breast Base of tongue NOS Bladder neck Bladder NOS Blood Body of pancreas Body of penis Body of stomach Bone marrow Bone of limb NOS Bone NOS Bones of skull and face and associated joints Border of tongue Brain stem Brain NOS Branchial cleft Breast NOS Broad ligament Cardia NOS Carotid body Cauda equina Cecum Central portion of breast Cerebellum NOS Cerebral meninges Cerebrum Cervical esophagus Cervix uteri Choroid Ciliary body Cloacogenic zone Colon NOS Commissure of lip Conjunctiva Connective subcutaneous and other soft tissues of abdomen Connective subcutaneous and other soft tissues of head face and neck Connective subcutaneous and other soft tissues of lower limb and hip Connective subcutaneous and other soft tissues of pelvis Connective subcutaneous and other soft tissues of thorax Connective subcutaneous and other soft tissues of trunk NOS Connective subcutaneous and other soft tissues of upper limb and shoulder Connective subcutaneous and other soft tissues NOS Cornea NOS Corpus uteri Cortex of adrenal gland Cranial nerve NOS Craniopharyngeal duct Descended testis Descending colon Dome of bladder Dorsal surface of tongue NOS Duodenum Endocervix Endocrine gland NOS Endometrium Epididymis Esophagus NOS Ethmoid sinus Exocervix External ear External lip NOS External lower lip External upper lip Extrahepatic bile duct Eye NOS Eyelid Fallopian tube Female genital tract NOS Floor of mouth NOS Frontal lobe Frontal sinus Fundus of stomach Fundus uteri Gallbladder Gastric antrum Gastrointestinal tract NOS Glans penis Glottis Greater curvature of stomach NOS Gum NOS Hard palate Head of pancreas Head face or neck NOS Heart Hematopoietic system NOS Hepatic flexure of colon Hypopharyngeal aspect of aryepiglottic fold Hypopharynx NOS Ileum Ill-defined sites within respiratory system Intestinal tract NOS Intra-abdominal lymph nodes Intrahepatic bile duct Intrathoracic lymph nodes Islets of Langerhans Isthmus uteri Jejunum Kidney NOS Labium majus Labium minus Lacrimal gland Laryngeal cartilage Larynx NOS Lateral floor of mouth Lateral wall of bladder Lateral wall of nasopharynx Lateral wall of oropharynx Lesser curvature of stomach NOS Lingual tonsil Lip NOS Liver Long bones of lower limb and associated joints Long bones of upper limb scapula and associated joints Lower gum Lower limb NOS Lower lobe lung Lower third of esophagus Lower-inner quadrant of breast Lower-outer quadrant of breast Lung NOS Lymph node NOS Lymph nodes of axilla or arm Lymph nodes of head face and neck Lymph nodes of inguinal region or leg Lymph nodes of multiple regions Main bronchus Major salivary gland NOS Male genital organs NOS Mandible Maxillary sinus Meckel diverticulum Mediastinum NOS Medulla of adrenal gland Meninges NOS Middle ear Middle lobe lung Middle third of esophagus Mouth NOS Mucosa of lip NOS Mucosa of lower lip Mucosa of upper lip Myometrium Nasal cavity Nasopharynx NOS Nervous system NOS Nipple Occipital lobe Olfactory nerve Optic nerve Orbit NOS Oropharynx NOS Other ill-defined sites Other specified parts of female genital organs Other specified parts of male genital organs Other specified parts of pancreas Ovary Overlapping lesion of accessory sinuses Overlapping lesion of bladder Overlapping lesion of bones joints and articular cartilage Overlapping lesion of bones joints and articular cartilage of limbs Overlapping lesion of brain Overlapping lesion of brain and central nervous system Overlapping lesion of breast Overlapping lesion of cervix uteri Overlapping lesion of colon Overlapping lesion of connective subcutaneous and other soft tissues Overlapping lesion of corpus uteri Overlapping lesion of digestive system Overlapping lesion of endocrine glands and related structures Overlapping lesion of esophagus Overlapping lesion of eye and adnexa Overlapping lesion of female genital organs Overlapping lesion of floor of mouth Overlapping lesion of heart mediastinum and pleura Overlapping lesion of hypopharynx Overlapping lesion of ill-defined sites Overlapping lesion of larynx Overlapping lesion of lip Overlapping lesion of lip oral cavity and pharynx Overlapping lesion of lung Overlapping lesion of major salivary glands Overlapping lesion of male genital organs Overlapping lesion of nasopharynx Overlapping lesion of other and unspecified parts of mouth Overlapping lesion of palate Overlapping lesion of pancreas Overlapping lesion of penis Overlapping lesion of peripheral nerves and autonomic nervous system Overlapping lesion of rectum anus and anal canal Overlapping lesion of respiratory system and intrathoracic organs Overlapping lesion of retroperitoneum and peritoneum Overlapping lesion of skin Overlapping lesion of small intestine Overlapping lesion of stomach Overlapping lesion of tongue Overlapping lesion of tonsil Overlapping lesion of urinary organs Overlapping lesion of vulva Overlapping lesions of oropharynx Palate NOS Pancreas NOS Pancreatic duct Parametrium Parathyroid gland Paraurethral gland Parietal lobe Parotid gland Pelvic bones sacrum coccyx and associated joints Pelvic lymph nodes Pelvis NOS Penis NOS Peripheral nerves and autonomic nervous system of abdomen Peripheral nerves and autonomic nervous system of head face and neck Peripheral nerves and autonomic nervous system of lower limb and hip Peripheral nerves and autonomic nervous system of pelvis Peripheral nerves and autonomic nervous system of thorax Peripheral nerves and autonomic nervous system of trunk NOS Peripheral nerves and autonomic nervous system of upper limb and shoulder Peritoneum NOS Pharynx NOS Pineal gland Pituitary gland Placenta Pleura NOS Postcricoid region Posterior mediastinum Posterior wall of bladder Posterior wall of hypopharynx Posterior wall of nasopharynx Posterior wall of oropharynx Prepuce Prostate gland Pylorus Pyriform sinus Rectosigmoid junction Rectum NOS Renal pelvis Reticuloendothelial system NOS Retina Retromolar area Retroperitoneum Rib sternum clavicle and associated joints Round ligament Scrotum NOS Short bones of lower limb and associated joints Short bones of upper limb and associated joints Sigmoid colon Skin of lip NOS skin of lower limb and hip Skin of other and unspecified parts of face Skin of scalp and neck Skin of trunk skin of upper limb and shoulder skin NOS Small intestine NOS Soft palate NOS Specified parts of peritoneum Spermatic cord Sphenoid sinus Spinal cord Spinal meninges Spleen Splenic flexure of colon Stomach NOS Subglottis Sublingual gland Submandibular gland Superior wall of nasopharynx Supraglottis Tail of pancreas Temporal lobe Testis NOS Thoracic esophagus Thorax NOS Thymus Thyroid gland Tongue NOS Tonsil NOS Tonsillar fossa Tonsillar pillar Trachea Transverse colon Trigone of bladder Undescended testis unknown primary site Upper gum Upper limb NOS Upper lobe lung Upper respiratory tract NOS Upper third of esophagus Upper-inner quadrant of breast Upper-outer quadrant of breast Urachus Ureter Ureteric orifice Urethra Urinary system NOS Uterine adnexa Uterus NOS Uvula Vagina NOS Vallecula Ventral surface of tongue NOS Ventricle NOS Vertebral column Vestibule of mouth Vulva NOS Waldeyer ring Biliary tract NOS Cheek mucosa Clitoris Overlapping lesion of biliary tract unknown Not Reported
